Country Code,Country Name,Source Geography,Source Institution Type,Year From,Year To,Source Country,Source Name,Project Name,Project Details,Amount,Original Currency,Exchange Rate,Exchange Rate Year,Finance Type,Sector,Status,Terms,Comments,Source urls
DZA,Algeria,Domestic,Domestic Innovation Funding,2023,2025,,Agence Nationale de Valorisation des Résultats de la Recherche & Startup Algeria,Programme Innovation Numérique & Incubateurs Technologiques Alger,Digital innovation program and Algiers technology incubators for startup ecosystem development,180,USD,,,Private Investment,capacity building,Active,Government-backed innovation funding for technology entrepreneurship and startup development,Emerging innovation ecosystem development supporting technology entrepreneurship,https://www.startup-algeria.dz/programme-innovation-incubateurs
DZA,Algeria,Domestic,Financial Institution Lending,2022,2025,,Banques Publiques Algériennes & Crédit Populaire d'Algérie,Financement PME Digitalisation & Services Bancaires Numériques,SME digitization financing and comprehensive digital banking services development,420,DZD,134.5,2024,Commercial Loan,DPI / DT General,Active,"6-10% interest rates, 3-7 year terms for SME digitization and banking modernization",State-dominated banking sector providing financing for private sector digitization,https://www.cpa-bank.dz/financement-pme-digitalisation
DZA,Algeria,Domestic,Government,2019,2025,,Agence Nationale de Développement de l'Investissement (ANDI),Modernisation e-Gouvernement & Administration Électronique Intégrée,E-government modernization and integrated electronic administration for improved public service delivery,1500,DZD,134.5,2024,Budget,e-government,Active,Government investment in comprehensive e-government platform and administrative modernization,Substantial e-government investment supporting administrative modernization and transparency,https://www.andi.dz/modernisation-e-gouvernement
DZA,Algeria,Domestic,Government,2020,2025,,Banque d'Algérie,Systèmes Paiement Digital & Infrastructure Financière Moderne,Digital payment systems modernization and modern financial infrastructure for economic diversification,680,DZD,134.5,2024,Budget,digital payment,Active,Central bank investment in payment systems modernization and financial inclusion initiatives,Payment system modernization supporting economic diversification beyond oil dependency,https://www.bank-of-algeria.dz/systemes-paiement-digital
DZA,Algeria,Domestic,Government,2021,2025,,Direction Générale de la Sûreté Nationale & Office National des Statistiques,Système National Identification Biométrique & Registre Population Unifié,National biometric identification system and unified population registry for comprehensive citizen services,950,DZD,134.5,2024,Budget,digital ID,Active,Government investment in advanced biometric ID system with comprehensive citizen registry,Major national ID system investment supporting citizen identification and government services,https://www.dgsn.gov.dz/systeme-identification-biometrique
DZA,Algeria,Domestic,Government,2020,2025,,Ministère de la Numérisation et des Statistiques,Stratégie Algérie Numérique 2030 & Transformation Digitale Nationale,National digital transformation strategy and comprehensive digitization of public services and economy,2800,DZD,134.5,2024,Budget,DPI / DT General,Active,Multi-year government investment leveraging oil revenues for comprehensive digital transformation,Major government investment reflecting oil wealth and state-led development model,https://www.mns.gov.dz/strategie-algerie-numerique-2030
DZA,Algeria,Domestic,Private Sector Investment,2020,2025,,Algérie Télécom,Extension Réseau Fibre Optique National & Infrastructure 5G,National fiber optic network expansion and 5G infrastructure deployment across Algeria,2100,USD,,,Grant/Concessional Loan,ICT infrastructure,Active,State-owned telecom operator investment in next-generation telecommunications infrastructure,Major state telecom investment in national connectivity and 5G deployment,https://www.algerietelecom.dz/extension-fibre-optique-5g
DZA,Algeria,Domestic,Private Sector Investment,2022,2025,,Mobilis (ATM),Réseau Mobile National & Services Télécoms Intégrés,National mobile network modernization and integrated telecommunications services development,750,USD,,,Grant/Concessional Loan,ICT infrastructure,Active,State-controlled mobile operator investment in national network and integrated services,State mobile operator investment complementing Algérie Télécom infrastructure development,https://www.mobilis.dz/reseau-mobile-services-integres
DZA,Algeria,Domestic,Private Sector Investment,2021,2025,,Ooredoo Algérie,Infrastructure Mobile 4G/5G & Services Digitaux Compétitifs,Competitive 4G/5G mobile infrastructure and comprehensive digital services development,980,USD,,,Grant/Concessional Loan,ICT infrastructure,Active,Private mobile operator investment in competitive infrastructure and digital services,Major private telecom investment driving competition and network quality improvement,https://www.ooredoo.dz/infrastructure-4g-5g-services
DZA,Algeria,Domestic,Private Sector Investment,2023,2025,,Secteur Bancaire Algérien & FinTech,Écosystème FinTech National & Solutions Paiement Électronique,National FinTech ecosystem development and electronic payment solutions for financial modernization,620,USD,,,Grant/Concessional Loan,digital payment,Active,Banking sector investment in FinTech development and electronic payment infrastructure,Banking sector modernization supporting economic diversification and digital financial services,https://www.fintech-algeria.com/ecosysteme-paiement-electronique
DZA,Algeria,Domestic,Private Sector Investment,2024,2025,,Secteur Pétrolier & Technologies Numériques,Digitalisation Secteur Énergétique & Smart Oil Technologies,Energy sector digitization and smart oil technologies for operational efficiency and diversification,850,USD,,,Grant/Concessional Loan,DPI / DT General,Active,Oil and gas sector investment in digital technologies and operational modernization,Energy sector digitization leveraging oil revenues for technological modernization,https://www.energy-digital-algeria.com/digitalisation-smart-oil
DZA,Algeria,International,Bilateral,2019,2025,France,Agence Française de Développement (AFD),Coopération Franco-Algérienne Numérique (Relations Complexes),Franco-Algerian digital cooperation constrained by complex post-colonial relations and political tensions,120,EUR,1.09,2024,Grant/Technical Assistance,capacity building,Active,French cooperation limited by complex post-colonial relations and political tensions,Limited French engagement due to complex post-colonial history and current political relations,https://www.afd.fr/fr/algerie-cooperation-numerique-relations-complexes
DZA,Algeria,International,Bilateral,2021,2025,China,China International Development Cooperation Agency,Algérie-Chine Infrastructure Numérique BRI & Coopération Stratégique,Chinese digital infrastructure and strategic cooperation through Belt and Road Initiative partnership,1200,USD,,,Concessional Loan,ICT infrastructure,Active,Major Chinese BRI investment in digital infrastructure and strategic cooperation,Largest bilateral partner reflecting Algeria's pivot toward non-Western partnerships,https://www.cidca.gov.cn/2021-09/25/c_1211387456.htm
DZA,Algeria,International,Bilateral,2022,2025,India,Export-Import Bank of India,Inde-Algérie Coopération Technologies & Innovation Digitale,Indian-Algerian technology cooperation and digital innovation through BRICS+ partnership,320,USD,,,Concessional Loan,DPI / DT General,Active,Indian EXIM bank cooperation for technology development and digital innovation,Non-OECD Indian cooperation reflecting BRICS+ partnership and South-South cooperation,https://www.eximbankindia.in/algeria-cooperation-technologies-innovation
DZA,Algeria,International,Bilateral,2022,2025,Russia,Russian Federal Agency for the Commonwealth of Independent States,Coopération Russo-Algérienne Technologies & Sécurité Numérique,Russian-Algerian technology cooperation and digital security for sovereignty and strategic partnership,450,USD,,,Grant/Concessional Loan,data governance,Active,Russian strategic cooperation providing technology expertise and digital security support,Major non-OECD Russian partnership reflecting geopolitical alignment and sovereignty priorities,https://www.rossotrudnichestvo.ru/algeria-cooperation-technologies-securite
DZA,Algeria,International,Bilateral,2023,2025,Turkey,Turkish Cooperation and Coordination Agency (TIKA),Turquie-Algérie Coopération Numérique & Technologies Méditerranéennes,Turkish-Algerian digital cooperation and Mediterranean technologies for regional partnership,280,USD,,,Grant/Technical Assistance,capacity building,Active,Turkish cooperation providing technology expertise and Mediterranean partnership development,Non-OECD Turkish cooperation reflecting diversified South-South partnerships,https://www.tika.gov.tr/algeria-cooperation-numerique-mediterranee
DZA,Algeria,International,Multilateral,2022,2025,Cote D'Ivoire,African Development Bank (AfDB),Algérie Infrastructure TIC & Connectivité Maghreb-Afrique,ICT infrastructure development and Maghreb-Africa connectivity for regional integration leadership,350,USD,,,Concessional Loan,ICT infrastructure,Active,AfDB investment in ICT infrastructure and Maghreb-African connectivity,AfDB investment supporting regional connectivity and African integration leadership,https://www.afdb.org/en/news-and-events/press-releases/algeria-afdb-350-million-ict
DZA,Algeria,International,Multilateral,2020,2025,Belgium,European Union,Partenariat UE-Algérie Économie Numérique & Coopération Méditerranéenne (Limité),Limited EU-Algeria digital economy partnership due to complex political relations and energy focus,180,EUR,1.09,2024,Grant/Technical Assistance,capacity building,Active,Limited EU partnership grant constrained by complex political relations,Limited EU engagement due to complex Algeria-EU relations and focus on energy cooperation,https://ec.europa.eu/international-partnerships/algerie-partenariat-numerique-limite_fr
DZA,Algeria,International,Multilateral,2023,2025,Switzerland,United Nations Development Programme,Algérie Gouvernance Numérique & Développement Durable,Digital governance modernization and sustainable development supporting institutional capacity,85,USD,,,Grant,data governance,Active,UNDP grant for digital governance frameworks and sustainable development,UN support for governance modernization and sustainable development priorities,https://www.undp.org/algeria/gouvernance-numerique-developpement
DZA,Algeria,International,Multilateral,2021,2025,United States,World Bank,Algeria Digital Government & Economic Diversification Project,Digital government modernization and economic diversification supporting private sector development,420,USD,,,Concessional Loan,DPI / DT General,Active,World Bank IBRD lending for digital government and economic diversification initiatives,World Bank engagement supporting government modernization and economic diversification,https://projects.worldbank.org/en/projects-operations/project-detail/P175234
DZA,Algeria,International,Philanthropic,2023,2025,Various,Fondations Éducation & Développement Technologique,Éducation Numérique & Développement Compétences Technologiques,Digital education and technology skills development for human capital advancement,45,USD,,,Grant,digital education,Active,Limited philanthropic grants for digital education and technology skills development,Minimal philanthropic presence due to regulatory constraints and government preferences,https://www.education-tech-algeria.org/numerique-competences
DZA,Algeria,International,Private FDI,2021,2025,China,Chinese Technology & Infrastructure Companies,Investissement Chinois Infrastructure Tech & Smart Cities,Chinese investment in technology infrastructure and smart cities development for modernization,680,USD,,,Grant/Concessional Loan,DPI / DT General,Active,Chinese private investment in technology infrastructure and urban development,Major Chinese private investment complementing government cooperation programs,https://www.sino-algeria-tech.com/infrastructure-smart-cities
DZA,Algeria,International,Private FDI,2024,2025,Various,Investissement International Limité Réglementation,Investissement Tech International Limité Cadre Réglementaire,Limited international technology investment due to restrictive regulatory framework and investment climate,150,USD,,,Grant/Concessional Loan,capacity building,Active,Limited international private investment due to restrictive regulatory environment,Minimal international FDI reflecting restrictive investment climate and regulatory constraints,https://www.limited-fdi-algeria.com/regulatory-framework
DZA,Algeria,International,Regional/Continental Initiatives,2020,2025,Ethiopia,African Union Digital Transformation Strategy,UA Transformation Digitale & Intégration Continentale Leadership,AU digital transformation strategy with Algerian continental leadership and integration component,220,USD,,,Grant,DPI / DT General,Active,Algerian participation in continental digital strategy with leadership role,AU Digital Transformation Strategy participation with continental leadership ambitions,https://au.int/sites/default/files/documents/38507-doc-DTS_for_Africa_2020-2030_English.pdf
DZA,Algeria,International,Regional/Continental Initiatives,2022,2025,Egypt,Arab League Digital Cooperation Initiative,Ligue Arabe Coopération Numérique & Leadership Technologies Arabes,Arab League digital cooperation and Arab technology development leadership for regional integration,320,USD,,,Grant,capacity building,Active,Arab League cooperation with Algerian leadership in digital development and Arab technology,Arab League participation reflecting strong Arab identity and regional leadership aspirations,https://www.arableague.org/digital-cooperation/algeria-leadership-technologies-arabes/
DZA,Algeria,International,Regional/Continental Initiatives,2021,2025,Rwanda,Smart Africa Trust Alliance (SATA),Smart Africa Connectivité Continentale & Leadership Algérie,Continental digital connectivity and Algerian leadership in African digital transformation,180,USD,,,Grant,DPI / DT General,Active,Algerian leadership participation in continental digital development,Smart Africa participation supporting continental integration and Algerian digital leadership,https://smartafrica.org/sas-project/connectivity-continentale-algeria-leadership/
DZA,Algeria,International,Regional/Continental Initiatives,2019,2025,Algeria,Union du Maghreb Arabe Initiative Technologique,UMA Intégration Technologique & Leadership Numérique Maghreb,Maghreb technological integration and digital leadership despite limited UMA institutional activity,150,USD,,,Grant,DPI / DT General,Active,Limited Maghreb cooperation for technology integration with Algerian leadership aspirations,Maghreb cooperation limited by regional tensions but maintaining technology focus and leadership,https://www.maghrebarabe.org/algeria-leadership-integration-technologique/
DZA,Algeria,International,Regional/Continental Initiatives,2021,2025,Various,Union for the Mediterranean Digital Initiative,UPM Coopération Numérique Méditerranéenne & Connectivité Sud-Nord,Mediterranean digital cooperation and South-North connectivity through Union for the Mediterranean,280,USD,,,Grant,ICT infrastructure,Active,Mediterranean cooperation for digital development and cross-Mediterranean connectivity,Mediterranean partnership leveraging geographic position despite complex EU relations,https://ufmsecretariat.org/algeria-cooperation-numerique-mediterraneenne/
AGO,Angola,Domestic,Domestic Innovation Funding,2021,2025,,Angola Innovation & Technology Fund,Technology Startup & Innovation Grants,"Grants for technology startups, R&D projects and digital innovation initiatives",35,AOA,850,2024,Grant,DPI / DT General,Active,Performance-based grants for technology innovation and startups,Government innovation funding for digital technology development,https://www.innovationfund.gov.ao/
AGO,Angola,Domestic,Domestic Innovation Funding,2019,2025,,Luanda Technology & Innovation Hub,Tech Incubation & Acceleration Programs,"Incubation, acceleration and seed funding for technology startups and digital innovations",25,AOA,850,2022,Private Investment,DPI / DT General,Active,"Seed funding, incubation services and acceleration programs",Leading technology incubation hub supporting digital innovation,https://www.luandatech.ao/
AGO,Angola,Domestic,Financial Institution Lending,2020,2025,,Banco Angolano de Investimentos & Commercial Banks,SME Digital Transformation Financing,Commercial bank lending to SMEs for digital adoption and technology upgrades,115,AOA,850,2024,Commercial Loan,DPI / DT General,Active,"18-25% interest rates, 1-5 year terms for SME digital transformation",Commercial bank lending for SME digital adoption and technology upgrades,https://www.bai.ao/sme-digital-financing
AGO,Angola,Domestic,Financial Institution Lending,2021,2025,,Banco de Desenvolvimento de Angola,Technology & Innovation Development Fund,"Development finance for technology companies, digital infrastructure and innovation projects",85,AOA,850,2023,Concessional Loan,DPI / DT General,Active,Concessional lending at 8-14% interest rates for technology sector,Development bank lending focused on technology and digital transformation,https://www.bda.ao/
AGO,Angola,Domestic,Government,2019,2025,,Angola Telecom (state-owned),National Fiber Optic Network & Broadband Infrastructure,National fiber optic backbone network and broadband infrastructure development across all provinces,185,AOA,850,2024,Budget,ICT infrastructure,Active,State enterprise investment in national telecommunications infrastructure,"State-owned telecom infrastructure investment, core ICT infrastructure focus",https://www.angolatelecom.ao/
AGO,Angola,Domestic,Government,2020,2025,,Ministry of Higher Education & ICT Institute,National Digital Literacy & Skills Development Programme,"Digital skills training across universities, technical institutes and adult education programs",85,AOA,850,2023,Budget,capacity building,Active,Multi-year digital literacy program across education sector,"Comprehensive digital skills development program, capacity building focus",https://www.mes.gov.ao/digital-skills
AGO,Angola,Domestic,Government,2018,2025,,Ministry of Public Administration & Social Security,E-Government Platform & Digital Services Development,National e-government platform development and digital service delivery infrastructure across government agencies,125,AOA,850,2020,Budget,e-government,Active,Multi-year e-government platform development across government ministries,Comprehensive e-government platform serving multiple government services,https://www.gov.ao/e-government
AGO,Angola,Domestic,Government,2025,,,"Ministry of Telecommunications, Information Technologies & Social Communication",National ICT & Digital Economy Budget FY25,"Annual federal budget allocation for ICT infrastructure, digital services, and Angola Digital 2030 strategy implementation",220,AOA,850,2025,Budget,ICT infrastructure,Active,Government annual budget allocation for digital transformation initiatives,"Primary focus on ICT infrastructure with digital economy components, significant oil revenue allocation",https://www.mctic.gov.ao/angola-digital-2030
AGO,Angola,Domestic,Government,2020,2025,,National Civil Registration Office,Angolan National Digital ID System (Cartão Nacional),National digital identity system rollout for 32M+ citizens with biometric registration and digital services integration,135,AOA,850,2024,Budget,digital ID,Active,Multi-year government commitment for national digital identity infrastructure,"Cartão Nacional system is comprehensive digital ID platform, clear digital ID sector focus",https://www.cartaonacional.gov.ao/
AGO,Angola,Domestic,Government,2021,2025,,National Cybersecurity Agency,National Cybersecurity Strategy & Data Protection Framework,"Cybersecurity infrastructure, data protection systems and governance frameworks development",55,AOA,850,2024,Budget,data governance,Active,Multi-year cybersecurity and data governance infrastructure development,Focus on cybersecurity and data protection governance frameworks,https://www.cybersecurity.gov.ao/
AGO,Angola,Domestic,Private Sector Investment,2020,2025,,Angolan Financial Technology Companies,Fintech Ecosystem & Digital Banking Development,"Investment in fintech startups, digital banking platforms and financial technology innovations",125,AOA,850,2024,Private Investment,digital payment,Active,Private investment in financial technology and digital banking services,"Growing fintech ecosystem, focus on digital payment services and banking platforms",https://www.fintech.ao/
AGO,Angola,Domestic,Private Sector Investment,2019,2025,,Angolan Technology & Innovation Startups,Tech Innovation Ecosystem Development,"Investment in technology startups across e-commerce, healthtech, edtech and digital services",95,AOA,850,2022,Private Investment,DPI / DT General,Active,Venture capital and private investment in technology startups,"Broad technology startup ecosystem investment, general digital transformation focus",https://www.startup.ao/
AGO,Angola,Domestic,Private Sector Investment,2018,2025,,Movicel Telecommunications,Mobile Money & Network Infrastructure Development,"Mobile money platform development, network infrastructure and digital financial services",285,AOA,850,2024,Grant/Concessional Loan,digital payment,Active,Private investment in mobile money and telecommunications infrastructure,"Second major mobile operator with focus on mobile money services, digital payment focus",https://www.movicel.co.ao/
AGO,Angola,Domestic,Private Sector Investment,2015,2025,,Unitel Angola,Mobile Network Infrastructure & Digital Services Expansion,"4G/5G network expansion, digital financial services and telecommunications infrastructure development",450,AOA,850,2024,Grant/Concessional Loan,ICT infrastructure,Active,Major private telecommunications infrastructure investment program,"Leading mobile operator infrastructure investment, focus on ICT connectivity",https://www.unitel.ao/
AGO,Angola,International,Bilateral,2020,2025,Brazil,Brazilian Development Bank (BNDES),Angola-Brazil Digital Innovation & Technology Transfer,"Technology transfer, digital innovation and telecommunications infrastructure development",125,USD,,,Concessional Loan,DPI / DT General,Active,BNDES loan for technology transfer and innovation ecosystem development,"Major non-OECD bilateral investment from BRICS partner, South-South cooperation",https://www.bndes.gov.br/wps/portal/site/home/imprensa/noticias/angola-brazil-digital-cooperation
AGO,Angola,International,Bilateral,2018,2025,China,China Development Bank/EXIM Bank,Angola Digital Silk Road Infrastructure Program,"ICT infrastructure, smart city technology, data centers and telecommunications under BRI framework",680,USD,,,Concessional Loan,ICT infrastructure,Active,Concessional loans with equipment procurement requirements from China,"Largest non-OECD bilateral investment in digital infrastructure under BRI, major China partnership",https://www.fmprc.gov.cn/mfa_eng/wjb_663304/zzjg_663340/xybfs_663590/xwlb_663592/202209/t20220928_10774686.html
AGO,Angola,International,Bilateral,2019,2025,Germany,GIZ/KfW Development Bank,Angola Digital Skills & Innovation Development,"Digital skills training, innovation ecosystem support and technology transfer",55,EUR,1.09,2024,Grant/Technical Assistance,capacity building,Active,German development cooperation for digital skills and innovation,Focus on digital skills development and innovation ecosystem support,https://www.giz.de/en/worldwide/316.html
AGO,Angola,International,Bilateral,2019,2025,Portugal,Instituto da Cooperação e da Língua,Angola-Portugal Digital Government & Innovation Program,"E-government systems, digital services and Portuguese language technology solutions",95,EUR,1.09,2024,Grant/Concessional Loan,e-government,Active,Portuguese development cooperation focused on e-government and digital services,Lusophone partnership focusing on e-government systems and Portuguese language solutions,https://www.instituto-camoes.pt/angola-digital-cooperation
AGO,Angola,International,Bilateral,2020,2025,United States,USAID,Angola Digital Economy & Governance Program,"Digital governance frameworks, civic technology and digital rights capacity building",45,USD,,,Grant,data governance,Active,Grant funding for digital governance and civic technology development,Focus on digital governance frameworks and civic technology applications,https://www.usaid.gov/angola/fact-sheets/digital-governance
AGO,Angola,International,Multilateral,2022,2027,Cote D'Ivoire,African Development Bank (AfDB),Angola ICT Infrastructure & Digital Economy Support,"Broadband infrastructure, digital financial services and technology innovation ecosystem support",220,USD,,,Concessional Loan,ICT infrastructure,Active,AfDB loan for ICT infrastructure and digital economy development,Focus on ICT connectivity infrastructure and digital economy ecosystem,https://www.afdb.org/en/news-and-events/press-releases/angola-afdb-approves-220-million-ict-infrastructure
AGO,Angola,International,Multilateral,2023,2026,Luxembourg,European Investment Bank,Southern Africa Digital Connectivity Initiative,Regional fiber optic connectivity and digital infrastructure development,115,EUR,1.09,2024,Concessional Loan,ICT infrastructure,Active,EIB loan for regional digital connectivity infrastructure,Angola component of regional Southern Africa digital infrastructure program,https://www.eib.org/en/press/all/2023-southern-africa-digital-connectivity
