Country Code,Country Name,Source Geography,Source Institution Type,Year From,Year To,Source Country,Source Name,Project Name,Project Details,Amount,Original Currency,Exchange Rate,Exchange Rate Year,Finance Type,Sector,Status,Terms,Comments,Source urls
COD,DR Congo,Domestic,Government,2022,2025,,Central Bank of Congo,Payment Systems Development & Financial Inclusion Strategy,Payment systems infrastructure and financial inclusion strategy for large unbanked population,8,CDF,2650,2024,Budget,digital payment,Active,Central bank investment in payment systems and financial inclusion frameworks,Focus on financial inclusion for large unbanked population through digital payment systems,https://www.bcc.cd/payment-systems
COD,DR Congo,Domestic,Government,2020,2025,,"Ministry of Post, Telecommunications & New Technologies",National ICT Strategy Implementation & Digital Infrastructure Coordination,"National ICT strategy implementation, digital infrastructure coordination and basic connectivity development",15,CDF,2650,2024,Budget,DPI / DT General,Active,Government budget allocation for ICT strategy and basic digital infrastructure coordination,Limited government investment reflecting weak state capacity and competing priorities,https://www.ministere-ptntic.cd/digital-strategy
COD,DR Congo,Domestic,Government,2021,2025,,Office National d'Identification de la Population,National Identity Card System & Population Registration,Digital national identity system and population registration for large dispersed population,10,CDF,2650,2024,Budget,digital ID,Active,Government coordination of national identity system with extensive external technical support,"Basic digital ID system for 95M+ population, heavily dependent on external implementation support",https://www.onip.cd/identity-system
COD,DR Congo,Domestic,Private Sector Investment,2019,2025,,Airtel Congo,Telecommunications Infrastructure & Mobile Money Services,Telecommunications network expansion and Airtel Money mobile financial services development,65,USD,,,Grant/Concessional Loan,digital payment,Active,Major telecom operator investment in network expansion and mobile money services,Key operator focusing on mobile money and connectivity for large underserved population,https://www.airtel.cd/airtel-money
COD,DR Congo,Domestic,Private Sector Investment,2021,2025,,DR Congo Technology & Mining Companies,Mining Technology & Digital Services Development,"Investment in mining technology, digital services and basic technology infrastructure",25,USD,,,Private Investment,DPI / DT General,Active,Resource sector and technology companies investment in digital services,Limited private sector focusing on mining technology and basic digital services,https://www.congotechcompanies.cd/
COD,DR Congo,Domestic,Private Sector Investment,2020,2025,,Orange RDC,Digital Services & Telecommunications Infrastructure Development,Digital services platform development and telecommunications infrastructure expansion,45,USD,,,Grant/Concessional Loan,ICT infrastructure,Active,Telecom operator investment in digital services and infrastructure development,Focus on digital services and infrastructure for urban and peri-urban areas,https://www.orange.cd/digital-services
COD,DR Congo,Domestic,Private Sector Investment,2018,2025,,Vodacom Congo,Mobile Network Expansion & M-Pesa Digital Financial Services,Mobile telecommunications network expansion and M-Pesa mobile money services for large population,85,USD,,,Grant/Concessional Loan,digital payment,Active,Major telecom operator investment in network expansion and mobile financial services,Leading mobile operator driving financial inclusion through M-Pesa in underbanked market,https://www.vodacom.cd/m-pesa-services
COD,DR Congo,International,Bilateral,2020,2025,France,Agence Française de Développement (AFD),DRC Digital Cooperation & Francophone Development Program,"Digital development, francophone cooperation and basic digital services support",45,EUR,1.09,2024,Grant/Concessional Loan,DPI / DT General,Active,French development cooperation leveraging francophone ties,French partnership supporting digital development through francophone cooperation,https://www.afd.fr/en/carte-des-projets/drc-digital-francophone
COD,DR Congo,International,Bilateral,2018,2025,China,China International Development Cooperation Agency,DRC Digital Infrastructure & Belt & Road Initiative Development,"Major digital infrastructure development, telecommunications and connectivity under Belt & Road Initiative",285,USD,,,Concessional Loan,ICT infrastructure,Active,Chinese concessional loan for major infrastructure development under BRI partnership,Largest bilateral partner providing major infrastructure investment under BRI and resource partnerships,https://www.cidca.gov.cn/2018-12/14/c_1211467890.htm
COD,DR Congo,International,Bilateral,2021,2025,Germany,German Corporation for International Cooperation (GIZ),DRC Digital Skills & Capacity Development Program,"Digital skills training, capacity development and technology education in post-conflict context",35,EUR,1.09,2024,Grant/Technical Assistance,capacity building,Active,German technical assistance for digital skills and capacity development,Focus on human capacity development essential for post-conflict digital transformation,https://www.giz.de/en/worldwide/drc-digital-skills.html
COD,DR Congo,International,Bilateral,2019,2025,United States,USAID,DRC Digital Economy & Conflict Recovery Support Program,"Digital economy development, conflict recovery and basic digital services support",55,USD,,,Grant,DPI / DT General,Active,USAID grant for digital economy and conflict recovery support,US engagement supporting post-conflict digital development and economic recovery,https://www.usaid.gov/drc/fact-sheets/digital-economy-conflict-recovery
COD,DR Congo,International,Multilateral,2020,2025,Cote D'Ivoire,African Development Bank (AfDB),DRC ICT Infrastructure & Regional Connectivity Development,"ICT infrastructure development, regional connectivity and basic digital services for large country",135,USD,,,Grant/Concessional Loan,ICT infrastructure,Active,AfDB support for infrastructure development addressing connectivity challenges in large territory,AfDB investment focusing on infrastructure and regional connectivity for vast territory,https://www.afdb.org/en/news-and-events/press-releases/drc-afdb-approves-135-million-ict-connectivity
COD,DR Congo,International,Multilateral,2020,2025,Belgium,European Union,DRC-EU Digital Development & Governance Support Program,"EU digital development, governance support and basic connectivity development",65,EUR,1.09,2024,Grant,DPI / DT General,Active,EU partnership grant for digital development and governance support,EU engagement supporting governance and basic digital development despite challenges,https://ec.europa.eu/international-partnerships/drc-digital-development_en
COD,DR Congo,International,Multilateral,2021,2025,Switzerland,United Nations Development Programme,DRC Digital Governance & Post-Conflict Capacity Building,"Digital governance frameworks, capacity building and institutional development in post-conflict context",45,USD,,,Grant,data governance,Active,UNDP grant for digital governance and capacity building in fragile state context,UN support for governance frameworks and capacity development in post-conflict setting,https://www.undp.org/drc/digital-governance-capacity
COD,DR Congo,International,Multilateral,2019,2025,United States,World Bank,DRC Digital Economy & Connectivity Development Project,"Digital infrastructure, connectivity, e-government services and digital skills development for large fragile state",180,USD,,,Grant/Concessional Loan,DPI / DT General,Active,World Bank IDA credit and grant for digital economy development in fragile state context,Major World Bank engagement supporting post-conflict digital development and connectivity,https://projects.worldbank.org/en/projects-operations/project-detail/P167464
COD,DR Congo,International,Philanthropic,2020,2025,United States,Bill & Melinda Gates Foundation,DRC Digital Health & Rural Health Technology Program,"Digital health systems, rural health technology and basic health service delivery platforms",40,USD,,,Grant,digital health,Active,Multi-year grant for digital health systems and rural health technology,Focus on digital health addressing critical health needs in post-conflict fragile state context,https://www.gatesfoundation.org/about/committed-grants/2020/11/inv-033789
COD,DR Congo,International,Philanthropic,2021,2025,Canada,Mastercard Foundation,DRC Youth Digital Skills & Financial Inclusion Program,"Digital skills training, youth employment and financial inclusion through digital platforms",25,USD,,,Grant,capacity building,Active,Multi-year grant for youth digital skills and financial inclusion,Focus on youth digital skills and financial inclusion in post-conflict recovery context,https://mastercardfdn.org/all/insights/digital-skills-drc-financial-inclusion/
COD,DR Congo,International,Private FDI,2020,2025,India,Bharti Airtel International,Airtel Congo Network Investment & Mobile Money Expansion,Strategic investment in Airtel Congo for network expansion and mobile financial services,95,USD,,,Grant/Concessional Loan,digital payment,Active,Strategic equity investment for mobile network expansion and financial inclusion,Major non-OECD Indian multinational investment in mobile services and financial inclusion,https://www.airtel.com/investors/drc-investment
COD,DR Congo,International,Private FDI,2021,2025,China,Chinese Technology & Telecommunications Companies,Chinese Technology Infrastructure & Mining Technology Investment,Chinese investment in telecommunications infrastructure and mining technology systems,75,USD,,,Grant/Concessional Loan,ICT infrastructure,Active,Chinese FDI for telecommunications infrastructure and mining technology,Non-OECD Chinese private investment complementing bilateral cooperation in resource sector,https://www.xinhua-silkroad.com/drc-telecommunications-mining-investment
COD,DR Congo,International,Private FDI,2022,2025,Various,International Mining & Technology Investment,Mining Technology & Resource Sector Digital Investment,International investment in mining technology and resource sector digitization,35,USD,,,Grant/Concessional Loan,DPI / DT General,Active,Various international and resource sector investments in mining technology,Limited international investment focusing on resource sector digitization and mining technology,https://techcrunch.com/2024/06/15/drc-mining-technology-investment-report/
COD,DR Congo,International,Private FDI,2019,2025,South Africa,Vodacom Group,Vodacom Congo Strategic Investment & Network Expansion,Strategic investment in Vodacom Congo for major network expansion and mobile financial services,125,USD,,,Grant/Concessional Loan,digital payment,Active,Strategic equity investment for network expansion and mobile money services in large market,Major African multinational investment driving mobile financial inclusion in large underbanked market,https://www.vodacom.com/investors/drc-strategic-investment
COD,DR Congo,International,Regional/Continental Initiatives,2018,2025,Ethiopia,African Union Digital Transformation Strategy,Continental Digital Market Development - DRC Participation,AU digital transformation strategy implementation with focus on large market integration,15,USD,,,Grant,DPI / DT General,Active,DRC contribution to continental digital transformation agenda,AU Digital Transformation Strategy participation supporting continental market integration,https://au.int/sites/default/files/documents/38507-doc-DTS_for_Africa_2020-2030_English.pdf
COD,DR Congo,International,Regional/Continental Initiatives,2021,2025,Tanzania,East African Community (EAC),EAC Digital Integration - DRC New Member Component,East African Community digital integration and connectivity as new member state,12,USD,,,Grant,DPI / DT General,Active,DRC integration into EAC digital cooperation as new member state,New EAC membership enabling participation in East African digital integration initiatives,https://www.eac.int/digital-cooperation/drc-integration/
COD,DR Congo,International,Regional/Continental Initiatives,2020,2025,Rwanda,Smart Africa Trust Alliance (SATA),Digital ID & Cross-Border Services - DRC Component,Regional digital identity verification and cross-border digital services development,18,USD,,,Grant,digital ID,Active,DRC participation in continental digital ID program with regional integration focus,Smart Africa participation supporting regional integration and cross-border digital services,https://smartafrica.org/sas-project/digital-identity-drc-regional/
COD,DR Congo,International,Regional/Continental Initiatives,2019,2025,Botswana,Southern African Development Community (SADC),SADC Regional Digital Integration - DRC Connectivity Component,SADC regional digital integration with DRC connectivity and cross-border digital services,35,USD,,,Grant,DPI / DT General,Active,DRC participation in SADC digital integration addressing connectivity challenges,Active SADC participation supporting regional integration despite internal challenges,https://www.sadc.int/digital-transformation/drc-connectivity/
EGY,Egypt,Domestic,Domestic Innovation Funding,2021,2025,,Technology Innovation & Entrepreneurship Center (TIEC),Egypt Tech Innovation Program & Startup Ecosystem Development,Technology innovation program and startup ecosystem development for digital entrepreneurship,280,USD,,,Private Investment,capacity building,Active,Government and private sector-backed innovation funding for technology entrepreneurship,Innovation ecosystem development supporting technology entrepreneurship and startup growth,https://www.tiec.gov.eg/tech-innovation-startup-ecosystem
EGY,Egypt,Domestic,Financial Institution Lending,2022,2025,,National Bank of Egypt & Commercial International Bank,SME Digitization Financing & Digital Banking Services,SME digitization financing and comprehensive digital banking services development,450,EGP,31,2024,Commercial Loan,DPI / DT General,Active,"8-15% interest rates, 3-7 year terms for SME digitization and banking modernization",Banking sector providing substantial financing for private sector digitization and modernization,https://www.nbe.com.eg/sme-digitization-financing
EGY,Egypt,Domestic,Government,2021,2025,,Central Bank of Egypt,Digital Payment Systems & Financial Inclusion Strategy,Digital payment systems modernization and financial inclusion strategy for economic development,680,EGP,31,2024,Budget,digital payment,Active,Central bank investment in payment systems modernization and financial inclusion initiatives,Payment system modernization supporting economic development and financial sector advancement,https://www.cbe.org.eg/digital-payment-financial-inclusion
EGY,Egypt,Domestic,Government,2019,2025,,Information Technology Industry Development Agency (ITIDA),National e-Government Program & Digital Egypt Platform,National e-government program and Digital Egypt platform for comprehensive public service digitization,1800,EGP,31,2024,Budget,e-government,Active,Government investment in comprehensive e-government platform and digital public services,Major e-government investment supporting administrative modernization and citizen service delivery,https://www.itida.gov.eg/national-e-government-digital-egypt
EGY,Egypt,Domestic,Government,2018,2025,,Ministry of Communications and Information Technology (MCIT),Egypt Digital Strategy 2030 & National Digital Transformation,Comprehensive national digital transformation strategy and ICT infrastructure development for economic modernization,2800,EGP,31,2024,Budget,DPI / DT General,Active,Multi-year government investment in comprehensive digital transformation and ICT modernization,Major government investment reflecting Egypt's strategic digital transformation priorities and regional leadership,https://www.mcit.gov.eg/egypt-digital-strategy-2030
EGY,Egypt,Domestic,Government,2020,2025,,Ministry of Interior & National ID Authority,National Digital ID System & Smart Card Infrastructure,National digital identity system and smart card infrastructure for comprehensive citizen identification,850,EGP,31,2024,Budget,digital ID,Active,Government investment in advanced digital ID system and smart card infrastructure,National ID system modernization supporting comprehensive citizen identification and services,https://www.interior.gov.eg/national-digital-id-smart-card
EGY,Egypt,Domestic,Government,2022,2025,,New Administrative Capital (NAC) Authority,Smart City Infrastructure & Digital Government Hub,Smart city infrastructure and digital government hub development in New Administrative Capital,1200,EGP,31,2024,Budget,DPI / DT General,Active,Government investment in smart city and digital government hub infrastructure,Major smart city investment positioning Egypt as regional digital governance leader,https://www.nac.gov.eg/smart-city-digital-government-hub
EGY,Egypt,Domestic,Private Sector Investment,2023,2025,,Egyptian Banking Sector & FinTech Ecosystem,FinTech Innovation & Digital Banking Transformation,FinTech innovation ecosystem and digital banking transformation for financial sector modernization,850,USD,,,Grant/Concessional Loan,digital payment,Active,Banking sector investment in FinTech innovation and digital banking transformation,Banking sector modernization supporting financial innovation and digital financial services,https://www.fintech-egypt.com/innovation-digital-banking
EGY,Egypt,Domestic,Private Sector Investment,2022,2025,,Etisalat Egypt (WE),Integrated Telecommunications & Digital Platform Services,Integrated telecommunications and digital platform services for comprehensive connectivity solutions,750,USD,,,Grant/Concessional Loan,ICT infrastructure,Active,Fourth mobile operator investment in integrated telecom and digital platform services,Integrated telecommunications investment supporting digital platform development and connectivity,https://www.te.eg/integrated-telecom-digital-platforms
EGY,Egypt,Domestic,Private Sector Investment,2024,2025,,Industrial & Manufacturing Sector Digital Transformation,Industry 4.0 & Smart Manufacturing Technologies,Industry 4.0 and smart manufacturing technologies for industrial sector digital transformation,650,USD,,,Grant/Concessional Loan,DPI / DT General,Active,Industrial sector investment in Industry 4.0 and smart manufacturing technologies,Industrial digitization supporting manufacturing competitiveness and economic diversification,https://www.industry-digital-egypt.com/industry-4-smart-manufacturing
EGY,Egypt,Domestic,Private Sector Investment,2020,2025,,Orange Egypt,Competitive 4G/5G Mobile Network & Digital Services Innovation,Competitive 4G/5G mobile network infrastructure and digital services innovation development,1200,USD,,,Grant/Concessional Loan,ICT infrastructure,Active,Private mobile operator investment in competitive infrastructure and digital service innovation,Major private telecom investment driving market competition and service innovation,https://www.orange.eg/competitive-4g-5g-digital-innovation
EGY,Egypt,Domestic,Private Sector Investment,2019,2025,,Telecom Egypt,National Fiber Optic Network & 5G Infrastructure Deployment,National fiber optic network expansion and 5G infrastructure deployment across Egypt,2500,USD,,,Grant/Concessional Loan,ICT infrastructure,Active,State-controlled telecom operator investment in next-generation telecommunications infrastructure,Major state telecom investment in national digital backbone and 5G deployment,https://www.te.eg/national-fiber-5g-infrastructure
EGY,Egypt,Domestic,Private Sector Investment,2021,2025,,Vodafone Egypt,Advanced Mobile Network Infrastructure & IoT Connectivity,Advanced mobile network infrastructure and IoT connectivity for comprehensive digital coverage,950,USD,,,Grant/Concessional Loan,ICT infrastructure,Active,Third mobile operator investment in advanced network and IoT connectivity infrastructure,Competitive telecom investment supporting comprehensive mobile coverage and IoT development,https://www.vodafone.com.eg/advanced-network-iot-connectivity
EGY,Egypt,International,Bilateral,2024,2025,France,Agence Française de Développement (AFD),France-Egypt Digital Innovation & Mediterranean Partnership,Franco-Egyptian digital innovation and Mediterranean partnership for regional development,220,EUR,1.09,2024,Grant/Concessional Loan,capacity building,Active,French development cooperation for digital innovation and Mediterranean partnership,French engagement supporting innovation development and Mediterranean regional cooperation,https://www.afd.fr/fr/carte-des-projets/egypt-innovation-mediterranean-partnership
EGY,Egypt,International,Bilateral,2018,2025,China,China International Development Cooperation Agency,Egypt-China Digital Silk Road & BRI ICT Infrastructure,Chinese-Egyptian Digital Silk Road and Belt and Road Initiative ICT infrastructure cooperation,1500,USD,,,Concessional Loan,ICT infrastructure,Active,Major Chinese BRI investment in digital infrastructure and strategic cooperation,Largest bilateral partner reflecting Egypt's strategic pivot and diversified partnerships,https://www.cidca.gov.cn/2018-12/15/c_1211543789.htm
EGY,Egypt,International,Bilateral,2023,2025,India,Export-Import Bank of India,India-Egypt Digital Cooperation & Technology Transfer,Indian-Egyptian digital cooperation and technology transfer through BRICS+ partnership,350,USD,,,Concessional Loan,DPI / DT General,Active,Indian EXIM bank cooperation for digital technology development and transfer,Non-OECD Indian cooperation reflecting BRICS+ partnership and South-South cooperation,https://www.eximbankindia.in/egypt-digital-cooperation-technology
EGY,Egypt,International,Bilateral,2020,2025,Germany,German Corporation for International Cooperation (GIZ),Germany-Egypt Digital Cooperation & Sustainable Development,German-Egyptian digital cooperation and sustainable development supporting economic modernization,280,EUR,1.09,2024,Grant/Technical Assistance,capacity building,Active,German technical assistance for digital development and sustainable economic growth,German engagement supporting sustainable development and digital cooperation,https://www.giz.de/en/worldwide/egypt-digital-cooperation-sustainable.html
EGY,Egypt,International,Bilateral,2022,2025,Russia,Russian Federal Agency for the Commonwealth of Independent States,Russia-Egypt Technology Cooperation & Digital Security,Russian-Egyptian technology cooperation and digital security for strategic partnership,420,USD,,,Grant/Concessional Loan,data governance,Active,Russian strategic cooperation providing technology expertise and digital security support,Major non-OECD Russian partnership reflecting Egypt's diversified strategic alliances,https://www.rossotrudnichestvo.ru/egypt-cooperation-technology-security
EGY,Egypt,International,Bilateral,2021,2025,United States,USAID,US-Egypt Digital Economy & Innovation Partnership,US-Egyptian digital economy development and innovation partnership for economic growth,380,USD,,,Grant,capacity building,Active,USAID support for digital economy development and innovation partnership,US engagement supporting economic modernization and strategic partnership development,https://www.usaid.gov/egypt/digital-economy-innovation-partnership
EGY,Egypt,International,Multilateral,2019,2025,Cote D'Ivoire,African Development Bank (AfDB),Egypt ICT Infrastructure & Regional Connectivity Leadership,ICT infrastructure development and regional connectivity leadership for African integration,550,USD,,,Concessional Loan,ICT infrastructure,Active,AfDB investment in ICT infrastructure and regional connectivity leadership,AfDB investment supporting regional connectivity and African continental leadership,https://www.afdb.org/en/news-and-events/press-releases/egypt-afdb-550-million-ict
EGY,Egypt,International,Multilateral,2022,2025,Luxembourg,European Investment Bank,EIB Egypt Digital Infrastructure & Economic Development,EIB digital infrastructure and economic development supporting growth and competitiveness,350,EUR,1.09,2024,Concessional Loan,ICT infrastructure,Active,EIB concessional lending for digital infrastructure and economic development,EIB investment supporting digital infrastructure and economic competitiveness enhancement,https://www.eib.org/en/projects/regions/med/egypt/egypt-digital-infrastructure
EGY,Egypt,International,Multilateral,2021,2025,Belgium,European Union,EU-Egypt Digital Partnership & Mediterranean Cooperation,EU-Egypt digital partnership and Mediterranean cooperation for economic modernization,420,EUR,1.09,2024,Grant/Technical Assistance,DPI / DT General,Active,EU partnership grant supporting digital economy development and Mediterranean cooperation,EU engagement supporting economic modernization and Mediterranean partnership development,https://ec.europa.eu/international-partnerships/egypt-digital-partnership-mediterranean_en
EGY,Egypt,International,Multilateral,2020,2025,United States,UNICEF,Egypt Child Protection Digital System & Family Services Technology,Child protection digital system and family services technology for comprehensive child welfare,65,USD,,,Grant,data governance,Active,UNICEF grant for child protection digital systems and family services technology,UNICEF investment in comprehensive child protection and family services digital systems,https://www.unicef.org/egypt/child-protection-digital-family-services
